<?xml version="1.0" encoding="UTF-8" ?>
<Layers xmlns:xsi="http://www.w3.org/2001/XMLSchema-instance"
	xmlns="http://xml.util.cbsviewer.mineleni.nl" xsi:schemaLocation="http://xml.util.cbsviewer.mineleni.nl AvailableLayers.xsd">
	<Layerdescriptor>
		<id>vierkanten500m_oad2000</id>
		<name>Vierkant 500m - Omgevingsadressendichtheid 2000</name>
		<layers>omgevings_adres_dichtheid_2000</layers>
		<url>http://geodata.nationaalgeoregister.nl/cbsvierkanten500m/wms</url>
		<styles>cbsvierkanten500m.oad2000</styles>
		<attributes>oad2000</attributes>
		<aliases>dichtheid</aliases>
	</Layerdescriptor>
	<!-- START SNIPPET: layermodel_apt_1 -->
	<Layerdescriptor>
		<id>wijkenbuurten2011_thema_gemeenten2011_aantal_inwoners</id>
		<name>CBS Gemeenten 2011 - Aantal inwoners</name>
		<layers>gemeenten2011</layers>
		<url>http://geodata.nationaalgeoregister.nl/wijkenbuurten2011/wms</url>
		<styles>wijkenbuurten2011_thema_gemeenten2011_aantal_inwoners</styles>
		<attributes>aantal_inwoners, gemnaam</attributes>
		<aliases>aantal_inwoners, gemeente</aliases>
		<link>http://geodata.nationaalgeoregister.nl/wijkenbuurten2011/wfs?request=GetFeature&amp;typeName=wijkenbuurten2011:gemeenten2011&amp;outputFormat=SHAPE-ZIP</link>
	</Layerdescriptor>
	<!-- START SNIPPET: layermodel_apt_1 -->
</Layers>