<?xml version="1.0" encoding="UTF-8" ?>
<Layers xmlns:xsi="http://www.w3.org/2001/XMLSchema-instance"
	xmlns="http://xml.util.cbsviewer.mineleni.nl" xsi:schemaLocation="http://xml.util.cbsviewer.mineleni.nl AvailableLayers.xsd ">
	<Layerdescriptor>
		<id>cbs_inwoners_2000_per_hectare</id>
		<name>inwoners 2000 per hectare</name>
		<layers>inwoners_2000</layers>
		<url>http://geodata.nationaalgeoregister.nl/cbsvierkanten100m/ows</url>
		<styles>cbsvierkanten100m_inw2000</styles>
		<attributes>inw2000</attributes>
	</Layerdescriptor>
	<Layerdescriptor>
		<id>toename_inwoners_2000_2010</id>
		<name>verandering inwoners 2000-2010</name>
		<layers>toename_inwoners_2000_2010</layers>
		<url>http://geodata.nationaalgeoregister.nl/cbsvierkanten100m2010/ows</url>
		<styles>cbsvierkanten100m_tinw_10_00</styles>
		<attributes>gid,tinw_10_00</attributes>
	</Layerdescriptor>
</Layers>